{
  "$schema": "http://json-schema.org/draft-07/schema#",
  "title": "PRIMA State",
  "description": "Project Registration, Indexing & Management Assistant — state file schema v1.0.0",
  "type": "object",
  "required": ["version", "workspace", "projects"],
  "properties": {
    "version": {
      "type": "string",
      "pattern": "^\\d+\\.\\d+\\.\\d+$",
      "description": "Semantic version of the state schema"
    },
    "workspace": {
      "type": "object",
      "required": ["name", "id", "type"],
      "properties": {
        "name": {
          "type": "string",
          "description": "Human-readable workspace name (e.g. 'Acme Construction Ltd')"
        },
        "id": {
          "type": "string",
          "pattern": "^[a-z0-9-]+$",
          "description": "URL-safe workspace identifier (e.g. 'acme-biz-os')"
        },
        "type": {
          "type": "string",
          "enum": ["personal", "client", "internal"],
          "description": "personal = owner's main workspace, client = client workspace, internal = non-client project"
        },
        "githubRepo": {
          "type": "string",
          "description": "GitHub repo in org/repo format (e.g. 'acme-org/acme-biz-os'). Empty string if no remote."
        }
      }
    },
    "projects": {
      "type": "array",
      "items": {
        "type": "object",
        "required": ["id", "name", "status", "category"],
        "properties": {
          "id": {
            "type": "string",
            "pattern": "^P\\d{3}$",
            "description": "Stable eternal ID. Format: P + 3-digit zero-padded number (P001–P999). Never reused, never changes meaning. Flexible numbering formats available with PRIMA Plugin."
          },
          "name": {
            "type": "string",
            "minLength": 1
          },
          "description": {
            "type": "string"
          },
          "status": {
            "type": "string",
            "enum": ["in-progress", "paused", "overdue", "archived"],
            "description": "Traffic light: green=in-progress, amber=paused, red=overdue, grey=archived"
          },
          "priority": {
            "type": "string",
            "enum": ["high", "medium", "low"]
          },
          "created": {
            "type": "string",
            "format": "date"
          },
          "dueDate": {
            "type": ["string", "null"],
            "format": "date"
          },
          "lastWorked": {
            "type": ["string", "null"],
            "format": "date"
          },
          "stoppedAt": {
            "type": ["string", "null"],
            "description": "Where work stopped on this project. Set by /night, cleared when project is next worked on."
          },
          "lastAction": {
            "type": ["string", "null"],
            "description": "Last completed action on this project. Set by /night."
          },
          "pausedReason": {
            "type": ["string", "null"],
            "description": "Required when status is 'paused'. Why is this on hold?"
          },
          "category": {
            "type": "string",
            "enum": ["client", "product", "internal", "marketing", "research", "operations", "finance", "sales", "legal", "it"],
            "description": "Primary project classification. One per project. Stored lowercase, displayed title case."
          },
          "tags": {
            "type": "array",
            "items": {"type": "string"},
            "description": "Freeform tags for cross-cutting concerns. Seed list: automation, integration, compliance, training, reporting, procurement, hr, crm, content, strategy, website, events, infrastructure, documentation, customer-support. Custom tags permitted."
          },
          "path": {
            "type": ["string", "null"],
            "description": "Relative path to project folder within workspace"
          },
          "notes": {
            "type": "string"
          },
          "companyName": {
            "type": ["string", "null"],
            "description": "Client company/organisation name. Required for client category projects."
          },
          "contacts": {
            "type": "array",
            "items": {"type": "string"},
            "description": "Contact names associated with this project. Full contact details stored in PRIMA CRM if installed. Required (min 1) for client category projects."
          }
        }
      }
    },
    "nextProjectNumber": {
      "type": "integer",
      "minimum": 1,
      "description": "The next number to use when creating a project. Incremented after each /newproject. Combined with projectNumbering config in integrations.json to generate the full ID."
    },
    "sessionHistory": {
      "type": "array",
      "maxItems": 20,
      "items": {
        "type": "object",
        "required": ["date", "summary"],
        "properties": {
          "date": {
            "type": "string",
            "format": "date"
          },
          "time": {
            "type": "string",
            "pattern": "^\\d{2}:\\d{2}$"
          },
          "summary": {
            "type": "string",
            "description": "1-2 sentence human-readable summary of the session"
          },
          "projectsWorked": {
            "type": "array",
            "items": {
              "type": "string",
              "pattern": "^P\\d{3}$"
            },
            "description": "Project IDs touched during this session"
          }
        }
      }
    },
    "priorities": {
      "type": "object",
      "properties": {
        "immediate": {
          "type": "array",
          "items": {"type": "string"}
        },
        "thisWeek": {
          "type": "array",
          "items": {"type": "string"}
        },
        "upcoming": {
          "type": "array",
          "items": {"type": "string"}
        }
      }
    },
    "pendingItems": {
      "type": "array",
      "items": {"type": "string"}
    },
    "recentWork": {
      "type": "array",
      "items": {"type": "string"},
      "description": "3-5 key activities from the most recent session. Replaced on each /night."
    },
    "selectedCalendars": {
      "type": "array",
      "items": {
        "type": "object",
        "properties": {
          "id": {"type": "string"},
          "name": {"type": "string"}
        }
      },
      "description": "Calendar IDs to query during /day. Empty array if no calendar integration."
    }
  }
}
